Status,Hub,Pin-Titel,Beschreibung,Ziel-Link,Bild-Link,Geplantes Datum
To Do,WM-Party,"Deutschland-Deko für die WM-Party: die komplette Liste","Schwarz-rot-gold Deko für die WM zuhause: Fahnen, Wimpelketten, Luftballons & Fan-Gear — die komplette Liste mit direkten Links. #wm2026 #deutschland #fussballparty #partydeko #rudelgucken",https://bethathost.de/watchparty/#cat-decor,https://d8j0ntlcm91z4.cloudfront.net/user_3EzQWq2PztIpmRyoVyluIhbJYPZ/hf_20260618_154512_9de10ad3-b2c3-479f-b6c6-6860854699f4.png,
To Do,WM-Party,"WM-Snacks zuhause: Currywurst, Nachos & Co.","Die besten Snacks für den Spieltag: Currywurst, Nachos, Brezeln & Dips — einfache Crowd-Pleaser mit Einkaufsliste. #wm2026 #partysnacks #fussballparty #gameday #fingerfood",https://bethathost.de/watchparty/#cat-food,https://d8j0ntlcm91z4.cloudfront.net/user_3EzQWq2PztIpmRyoVyluIhbJYPZ/hf_20260618_150654_aa902677-5a24-45f2-84d8-61e35048d94c.jpeg,
To Do,WM-Party,"Beamer & Setup für die perfekte WM-Party","So wird jede Wand zur Großleinwand: Beamer, Leinwand, Soundbar & Streaming-Stick fürs Rudelgucken zuhause. #wm2026 #heimkino #beamer #fussballparty #watchparty",https://bethathost.de/watchparty/#cat-setup,https://d8j0ntlcm91z4.cloudfront.net/user_3EzQWq2PztIpmRyoVyluIhbJYPZ/hf_20260618_150651_29279e03-2d36-4971-afd4-b826558999b8.png,
To Do,WM-Party,"Getränke-Station für die WM-Party","Kühlbox, Tisch-Zapfanlage & schwarz-rot-gold Becher: die Selbstbedienungs-Getränkestation für den Spieltag. #wm2026 #partygetraenke #fussballparty #gameday #rudelgucken",https://bethathost.de/watchparty/#cat-drinks,https://d8j0ntlcm91z4.cloudfront.net/user_3EzQWq2PztIpmRyoVyluIhbJYPZ/hf_20260618_154515_639f6e70-4162-4109-b187-9eb0f2a1c49f.png,
To Do,WM-Party,"WM-Tippspiel & Spiele für den Spieltag","Spielplan-Poster, Tippspiel-Block & Tischkicker — so wird sogar die Halbzeit zum Highlight. #wm2026 #tippspiel #fussballparty #spieltag #gameday",https://bethathost.de/watchparty/#cat-games,https://d8j0ntlcm91z4.cloudfront.net/user_3EzQWq2PztIpmRyoVyluIhbJYPZ/hf_20260618_154516_12c268d6-e146-447c-bf79-3eed2cf02f18.png,
